{
  "schema_version": 1,
  "baseline_commit": "5deac563f21210529124c2c0a9101ab5befde4e1",
  "profiles": [
    {
      "id": "luxury",
      "version": 1,
      "name_ar": "فاخر",
      "name_en": "Luxury",
      "purpose": "Bootstrap composition for a premium storefront: wide layout, spacious rhythm, rounded corners, elevated cards. Final visual identity is owned by HDL-24.",
      "owned_values": {
        "layout_width": "wide",
        "section_spacing": "spacious",
        "corner_style": "rounded",
        "product_card_style": "elevated",
        "header_layout": "centered",
        "header_density": "comfortable"
      },
      "deferred_values": {
        "final_visual_identity": "HDL-24"
      }
    },
    {
      "id": "modern",
      "version": 1,
      "name_ar": "عصري",
      "name_en": "Modern",
      "purpose": "Bootstrap composition matching the current theme defaults for a stable activation path. Final visual identity is owned by HDL-25.",
      "owned_values": {
        "layout_width": "wide",
        "section_spacing": "balanced",
        "corner_style": "square",
        "product_card_style": "minimal",
        "header_layout": "centered",
        "header_density": "comfortable"
      },
      "deferred_values": {
        "final_visual_identity": "HDL-25"
      }
    },
    {
      "id": "minimal",
      "version": 1,
      "name_ar": "بسيط",
      "name_en": "Minimal",
      "purpose": "Bootstrap composition for a quiet storefront: wide layout, spacious rhythm, square corners, minimal cards. Final visual identity is owned by HDL-26.",
      "owned_values": {
        "layout_width": "wide",
        "section_spacing": "spacious",
        "corner_style": "square",
        "product_card_style": "minimal",
        "header_layout": "centered",
        "header_density": "comfortable"
      },
      "deferred_values": {
        "final_visual_identity": "HDL-26"
      }
    },
    {
      "id": "practical_digital",
      "version": 1,
      "name_ar": "عملي رقمي",
      "name_en": "Practical Digital",
      "purpose": "Bootstrap composition for a dense digital-goods storefront: compact layout, spacing, and header with soft corners and bordered cards. Final visual identity is owned by HDL-27.",
      "owned_values": {
        "layout_width": "compact",
        "section_spacing": "compact",
        "corner_style": "soft",
        "product_card_style": "bordered",
        "header_layout": "start",
        "header_density": "compact"
      },
      "deferred_values": {
        "final_visual_identity": "HDL-27"
      }
    }
  ],
  "settings": [
    {
      "key": "global::hadeel-design-title",
      "id": "hadeel-design-title",
      "scope": "global",
      "source_path": "twilight.json#/settings/0",
      "owner_spec": "HDL-03",
      "tier": "structural",
      "type": "static",
      "allowed_values": [],
      "declared_default": null,
      "safe_default": null,
      "preset_support": false,
      "override_support": false,
      "mode_setting": null,
      "class_prefix": null,
      "base_variant": false,
      "label_ar": "هوية وتصميم الثيم",
      "label_en": "Hadeel design identity",
      "description": "Static panel heading grouping the Hadeel identity settings in the Salla settings panel.",
      "evidence_status": "existing"
    },
    {
      "key": "global::announcement_enabled",
      "id": "announcement_enabled",
      "scope": "global",
      "source_path": "twilight.json#/settings/1",
      "owner_spec": "HDL-07",
      "tier": "basic",
      "type": "boolean",
      "allowed_values": [
        true,
        false
      ],
      "declared_default": true,
      "safe_default": true,
      "preset_support": false,
      "override_support": false,
      "mode_setting": null,
      "class_prefix": null,
      "base_variant": false,
      "label_ar": "عرض شريط الإعلان",
      "label_en": "Show announcement bar",
      "description": "Existing switch gating the announcement bar; read with fallback true in components/header/header.twig.",
      "evidence_status": "existing"
    },
    {
      "key": "global::announcement_text",
      "id": "announcement_text",
      "scope": "global",
      "source_path": "twilight.json#/settings/2",
      "owner_spec": "HDL-07",
      "tier": "basic",
      "type": "string",
      "allowed_values": [],
      "declared_default": "",
      "safe_default": "",
      "preset_support": false,
      "override_support": false,
      "mode_setting": null,
      "class_prefix": null,
      "base_variant": false,
      "label_ar": "نص شريط الإعلان",
      "label_en": "Announcement bar text",
      "description": "Merchant-entered multilingual announcement copy; the bar stays hidden while this is empty.",
      "evidence_status": "existing"
    },
    {
      "key": "global::announcement_style",
      "id": "announcement_style",
      "scope": "global",
      "source_path": "twilight.json#/settings/3",
      "owner_spec": "HDL-07",
      "tier": "basic",
      "type": "items",
      "allowed_values": [
        "primary",
        "dark",
        "gradient"
      ],
      "declared_default": "primary",
      "safe_default": "primary",
      "preset_support": false,
      "override_support": false,
      "mode_setting": null,
      "class_prefix": "announcement-bar--",
      "base_variant": false,
      "label_ar": "نمط شريط الإعلان",
      "label_en": "Announcement bar style",
      "description": "Existing variant selector rendered as announcement-bar--{value} in header.twig; all three values have SCSS selectors in storefront-system.scss.",
      "evidence_status": "existing"
    },
    {
      "key": "global::announcement_show_icon",
      "id": "announcement_show_icon",
      "scope": "global",
      "source_path": "twilight.json#/settings/4",
      "owner_spec": "HDL-07",
      "tier": "basic",
      "type": "boolean",
      "allowed_values": [
        true,
        false
      ],
      "declared_default": true,
      "safe_default": true,
      "preset_support": false,
      "override_support": false,
      "mode_setting": null,
      "class_prefix": null,
      "base_variant": false,
      "label_ar": "عرض أيقونة في شريط الإعلان",
      "label_en": "Show announcement bar icon",
      "description": "Existing switch for the announcement icon; read with fallback true in header.twig.",
      "evidence_status": "existing"
    },
    {
      "key": "global::use_theme_font",
      "id": "use_theme_font",
      "scope": "global",
      "source_path": "twilight.json#/settings/5",
      "owner_spec": "HDL-03",
      "tier": "basic",
      "type": "boolean",
      "allowed_values": [
        true,
        false
      ],
      "declared_default": false,
      "safe_default": false,
      "preset_support": false,
      "override_support": false,
      "mode_setting": null,
      "class_prefix": null,
      "base_variant": false,
      "label_ar": "استخدام خط ثيم هديل",
      "label_en": "Use Hadeel theme font",
      "description": "Deprecated compatibility no-op (HDL-05 T005F): still rendered as the use-theme-font body class in master.twig so merchant storage and markup stay valid, but no longer selects any bundled font — runtime font is Salla theme.font via --font-main with a system fallback. Merchant-controlled and never follows a preset profile.",
      "evidence_status": "existing"
    },
    {
      "key": "global::layout_width",
      "id": "layout_width",
      "scope": "global",
      "source_path": "twilight.json#/settings/6",
      "owner_spec": "HDL-03",
      "tier": "basic",
      "type": "items",
      "allowed_values": [
        "compact",
        "wide",
        "full"
      ],
      "declared_default": "wide",
      "safe_default": "wide",
      "preset_support": true,
      "override_support": true,
      "mode_setting": "global::layout_width_mode",
      "class_prefix": "hadeel-layout-",
      "base_variant": false,
      "label_ar": "عرض محتوى المتجر",
      "label_en": "Store content width",
      "description": "Preset-aware follower. Rendered as hadeel-layout-{value} in master.twig with fallback wide; all values have SCSS selectors. Mode key: global::layout_width_mode.",
      "evidence_status": "existing"
    },
    {
      "key": "global::section_spacing",
      "id": "section_spacing",
      "scope": "global",
      "source_path": "twilight.json#/settings/7",
      "owner_spec": "HDL-03",
      "tier": "basic",
      "type": "items",
      "allowed_values": [
        "compact",
        "balanced",
        "spacious"
      ],
      "declared_default": "balanced",
      "safe_default": "balanced",
      "preset_support": true,
      "override_support": true,
      "mode_setting": "global::section_spacing_mode",
      "class_prefix": "hadeel-spacing-",
      "base_variant": false,
      "label_ar": "المسافة بين أقسام الصفحة",
      "label_en": "Section spacing",
      "description": "Preset-aware follower. Rendered as hadeel-spacing-{value} in master.twig with fallback balanced; all values have SCSS selectors. Mode key: global::section_spacing_mode.",
      "evidence_status": "existing"
    },
    {
      "key": "global::corner_style",
      "id": "corner_style",
      "scope": "global",
      "source_path": "twilight.json#/settings/8",
      "owner_spec": "HDL-03",
      "tier": "basic",
      "type": "items",
      "allowed_values": [
        "square",
        "soft",
        "rounded"
      ],
      "declared_default": "square",
      "safe_default": "square",
      "preset_support": true,
      "override_support": true,
      "mode_setting": "global::corner_style_mode",
      "class_prefix": "hadeel-corners-",
      "base_variant": false,
      "label_ar": "استدارة البطاقات والصور",
      "label_en": "Corner style",
      "description": "Preset-aware follower. Rendered as hadeel-corners-{value} in master.twig with fallback square; all values have SCSS selectors. Mode key: global::corner_style_mode.",
      "evidence_status": "existing"
    },